{
  "schemaVersion": 1,
  "id": "prawn-gnocchi",
  "title": "Garlic Prawns with Crisp Gnocchi",
  "description": "The gnocchi goes in dry and crisps like a potato. The prawns go in last.",
  "category": "Mediterranean & Middle Eastern",
  "tags": ["prawns", "gnocchi", "one-pan"],
  "yield": { "qty": 2, "unit": "serves" },
  "time": { "label": "~25 min", "totalMinutes": 25 },
  "appliances": ["stovetop"],
  "confidence": { "level": "estimated", "note": "No confidence note was recorded in the legacy card." },
  "methodLabel": "Cast iron, one pan",
  "ingredientGroups": [
    {
      "items": [
        { "id": "prawns", "qty": 400, "unit": "g", "item": "raw prawns in garlic sauce" },
        { "id": "gnocchi", "qty": 500, "unit": "g", "item": "shelf-stable potato gnocchi" },
        { "id": "tomatoes", "qty": 3, "item": "medium tomatoes", "note": "Roma or truss if you have them" },
        { "id": "oil", "qty": 2, "unit": "tbsp", "item": "rice bran or olive oil" },
        { "id": "butter", "qty": 30, "unit": "g", "item": "butter" },
        { "id": "lemon", "qty": 2, "unit": "tbsp", "item": "lemon juice" },
        { "id": "chilli", "qty": 0.5, "unit": "tsp", "item": "chilli flakes" },
        { "id": "parsley", "qty": 3, "unit": "tbsp", "item": "flat-leaf parsley", "prep": "roughly chopped" },
        { "id": "salt", "qty": 0.5, "unit": "tsp", "item": "salt", "note": "For drawing water from the tomatoes" }
      ]
    }
  ],
  "steps": [
    { "text": "Quarter the tomatoes ({{tomatoes}}), scoop out the seeds and watery pulp with your thumb, then cut into rough 2cm chunks. Toss with the salt ({{salt}}) and sit in a colander to drain 10 minutes. This is the step that keeps the pan from going watery.", "settings": { "appliance": "none", "time": "10 min", "timerSeconds": 600 } },
    { "text": "Heat the cast iron over medium-high with the oil ({{oil}}). Add the gnocchi ({{gnocchi}}) straight from the packet in a single layer, no boiling. Leave it alone to catch colour, then toss and give it another few minutes until golden on two or three sides. Tip onto a plate." },
    { "text": "Pat the tomatoes dry. Same pan, still medium-high, cut side down. Leave them until they collapse and start to catch, about 4 minutes, then push to one side.", "settings": { "appliance": "stovetop", "time": "~4 min", "timerSeconds": 240 } },
    { "text": "Drop the heat to medium. Add the prawns ({{prawns}}) with all the sauce in one layer. Turn once. They are done when opaque and curled into a loose C. A tight O means overcooked. Pull the pan off the heat the moment they get there." },
    { "text": "Off the heat, add the butter ({{butter}}), lemon juice ({{lemon}}) and chilli flakes ({{chilli}}). Swirl until the butter melts into the garlic sauce and goes glossy. Return the gnocchi and tomatoes, toss to coat, and scatter the parsley ({{parsley}})." }
  ],
  "notes": [
    { "title": "Restored", "text": "This card was in the August build and dropped out of later rebuilds. Restored unchanged from the August version." },
    { "title": "Butter off heat", "text": "Adding it off the heat emulsifies the sauce. Straight into a hot pan it splits." },
    { "title": "Salt", "text": "The bought garlic sauce is already seasoned. Hold the salt until you have tasted at the end." },
    { "title": "Draining the tomatoes", "text": "Not optional. Skip it and the gnocchi loses its crust in the toss." }
  ],
  "version": 1,
  "updated": "2026-10-25"
}
